{
  "id": "apr_01JAB3Z9X8K7M6N5P4Q3R2S1T0",
  "kind": "publish",
  "actionHash": "dddddddddddddddddddddddddddddddddddddddddddddddddddddddddddddddd",
  "summary": "Post LinkedIn draft v2",
  "requestedBy": "linkedin-manager",
  "approverRequired": "owner",
  "status": "consumed",
  "usesLeft": 0,
  "createdAt": "2026-10-18T09:00:00Z",
  "expiresAt": "2026-10-21T09:00:00Z",
  "taskId": "task_01JAB3Z9X8K7M6N5P4Q3R2S1T0",
  "verdictId": "vrd_01JAB3Z9X8K7M6N5P4Q3R2S1T0",
  "payloadRef": "staging/post.md",
  "channel": {
    "id": "linkedin-personal",
    "mode": "manual",
    "method": "copy",
    "tosRisk": "low"
  },
  "decidedBy": "owner",
  "decidedAt": "2026-10-18T10:30:00-05:00",
  "reason": "looks good",
  "postponedUntil": "2026-10-18T10:30:00-05:00"
}
